record_id,legacy_record_id,event_id,victim_name,victim_alias,victim_age,victim_age_group,victim_gender,victim_role,occupation,doctor_flag,nurse_flag,medic_flag,teacher_flag,journalist_flag,student_flag,child_flag,adult_flag,civilian_flag,combatant_flag,leader_flag,commander_flag,organization_affiliation,arrests,detention,image_available,image_url,image_source,image_license,image_caption,media_warning,verification_status,notes,is_famous,fame_reason,summary_brief,death_context,verified_by,news_headline,news_summary,news_source_url,news_date,news_category
1,per_007,EVT-021,unknown,,,child,unknown,child,,false,false,false,false,false,false,true,false,true,false,false,false,,false,,,,,,verified,"ICRC reported that over 7,000 children received nutritional supplements in Al Obeid food assistance program; no individual names provided.",false,,,,,,,,,,,
2,per_008,EVT-022,unknown,,,adult,unknown,adult civilian,weapon-wounded patient,false,false,false,false,false,false,false,true,true,false,false,false,,false,,,,,,verified,ICRC reported that over 850 weapon-wounded patients were treated at Al Obeid Teaching Hospital; no individual identities provided.,false,,,,,,,,,,,
3,per_009,EVT-024,unknown,,,adult,unknown,adult civilian,humanitarian worker,false,false,false,false,false,false,false,true,true,false,false,false,,false,,,,,,verified,ICRC humanitarian staff involved in first RED aircraft operations establishing air corridor between Port Sudan and Khartoum; no individual names provided.,false,,,,,,,,,,,
4,per_010,EVT-036,Yagoub Ibrahim Mousa,Yaqoub Ibrahim Mousa,,adult,male,military commander,RSF senior commander,false,false,false,false,false,false,false,true,false,true,true,true,Rapid Support Forces (RSF),,,false,,,,,,verified,Confirmed RSF commander death (Reuters 2024). Cross-linked to leader LDR-018.,true,"Senior RSF commander, death confirmed by Reuters.","Senior RSF commander killed near Wad Madani, 27 Feb 2024.",Killed in combat near Wad Madani.,SRC-S012|SRC-S013,,,,,
5,per_011,EVT-037,Abdel Rahman Abu Mousa,,,adult,male,military commander,RSF senior field commander,false,false,false,false,false,false,false,true,false,true,true,true,Rapid Support Forces (RSF),,,false,,,,,,verified,Confirmed RSF commander death (Reuters 2023). Cross-linked to leader LDR-019.,true,"Senior RSF Khartoum-area commander, death confirmed by Reuters.","Senior RSF field commander killed in Khartoum, Nov 2023.",Killed in combat in Khartoum.,SRC-S014|SRC-S015,,,,,
