record_id,event_id,victim_name,victim_alias,victim_age,victim_age_group,victim_gender,victim_role,occupation,doctor_flag,nurse_flag,medic_flag,teacher_flag,journalist_flag,student_flag,child_flag,adult_flag,civilian_flag,combatant_flag,leader_flag,commander_flag,organization_affiliation,image_available,image_url,image_source,image_license,image_caption,media_warning,verification_status,notes
per_001,EVT-002,unknown,,,child,female,child,,false,false,false,false,false,false,true,false,true,false,false,false,,false,,,,,,verified,"OCHA reported that a baby daughter was among those killed in the Al Mawasi airstrike; no name was provided."
per_002,EVT-002,unknown,,,adult,female,adult civilian,,false,false,false,false,false,false,false,true,true,false,false,false,,false,,,,,,verified,"OCHA reported that a mother was killed in the Al Mawasi airstrike; no name was provided."
per_003,EVT-003,unknown,,,child,unknown,child,,false,false,false,false,false,false,true,false,true,false,false,false,,false,,,,,,verified,"OCHA reported that a fifth-grade child died from injuries sustained in an airstrike near a temporary education learning space; no name was provided."
per_004,EVT-004,unknown,17,child,female,child,student,false,false,false,false,false,true,true,false,true,false,false,false,,false,,,,,,verified,"OCHA reported that a 17-year-old girl was killed on her way to sit for a high school exam; no name was provided."
per_005,EVT-006,unknown,,,child,unknown,child,,false,false,false,false,false,false,true,false,true,false,false,false,,false,,,,,,verified,"OCHA reported that a Bedouin household of eight people included four children and three women; no individual names were provided."
